{
  "schema_version": "1",
  "stack": "django",
  "base_script": {"stack": "django", "version": "0.3.0"},
  "about": {"reads": "The admin registry of every mounted admin site, each ModelAdmin's class hierarchy and the project's Map Rules, as the booted settings load them.", "holds": ["Roles, grants, scopes and capabilities from the Map Rules in tools/access-map/project.py", "Every admin model page as a capability, its model as an area", "Every admin URL: which has_*_permission Django calls for it, and the first-party overrides of those methods with source and file:line", "Permissions each endpoint checks, and the stack's reading of superuser-only and staff rules"], "heuristics": ["Admin URL → which has_*_permission Django calls (from the URL suffix)", "Permissions found in override code by pattern (\"app.\" + CONSTANT)", "An override ending in `return False` → nobody; `return request.user.is_superuser` → superuser; `raise Http404` in the page view → page off", "A get_queryset override → a scope candidate"], "command": "python tools/access-map/introspect.py"},
  "roles": [
    {"id": "clerk", "kind": "group", "at": "shop/roles.py:4", "basis": "rule", "includes": [], "staff": {"at": "shop/signin.py:5"}},
    {"id": "manager", "kind": "group", "at": "shop/roles.py:5", "basis": "rule", "includes": [{"role": "clerk", "at": "shop/signin.py:7"}], "staff": null},
    {"id": "superuser", "kind": "superuser", "at": "django/contrib/auth/models.py:328", "basis": "extracted", "includes": [], "staff": null}
  ],
  "grants": {
    "shop.add_product": [{"role": "manager", "at": "shop/roles.py:5"}],
    "shop.change_order": [{"role": "manager", "at": "shop/roles.py:5"}],
    "shop.change_product": [{"role": "manager", "at": "shop/roles.py:5"}],
    "shop.delete_order": [{"role": "manager", "at": "shop/roles.py:5"}],
    "shop.view_order": [{"role": "clerk", "at": "shop/roles.py:4"}],
    "shop.view_product": [{"role": "clerk", "at": "shop/roles.py:4"}]
  },
  "scopes": [
    {"id": "shop.order.get_queryset", "label": "OrderAdmin.get_queryset", "at": "shop/admin.py:13", "basis": "inferred"}
  ],
  "scoped": [
    {"capability": "shop.order.view", "role": "clerk", "scope": "shop.order.get_queryset", "at": "shop/admin.py:17", "basis": "rule"}
  ],
  "capabilities": [
    {"id": "shop.order.add", "area": "shop.order", "term": "Order", "verb": "write", "endpoints": [["ANY", "/admin/shop/order/add/", "django.contrib.admin.options.ModelAdmin.add_view"]], "check": "shop.add_order", "at": "shop/admin.py:12", "basis": "extracted"},
    {"id": "shop.order.change", "area": "shop.order", "term": "Order", "verb": "write", "endpoints": [["ANY", "/admin/shop/order/{object_id}/change/", "django.contrib.admin.options.ModelAdmin.change_view"]], "check": "shop.change_order", "at": "shop/admin.py:12", "basis": "extracted"},
    {"id": "shop.order.delete", "area": "shop.order", "term": "Order", "verb": "write", "endpoints": [["ANY", "/admin/shop/order/{object_id}/delete/", "django.contrib.admin.options.ModelAdmin.delete_view"]], "check": "shop.delete_order", "at": "shop/admin.py:12", "basis": "extracted"},
    {"id": "shop.order.view", "area": "shop.order", "term": "Order", "verb": "read", "endpoints": [["ANY", "/admin/shop/order/", "django.contrib.admin.options.ModelAdmin.changelist_view"], ["ANY", "/admin/shop/order/{object_id}/history/", "django.contrib.admin.options.ModelAdmin.history_view"]], "check": "shop.view_order", "at": "shop/admin.py:12", "basis": "extracted"},
    {"id": "shop.product.add", "area": "shop.product", "term": "Product", "verb": "write", "endpoints": [["ANY", "/admin/shop/product/add/", "django.contrib.admin.options.ModelAdmin.add_view"]], "check": "shop.add_product", "at": "shop/models.py:4", "basis": "extracted"},
    {"id": "shop.product.change", "area": "shop.product", "term": "Product", "verb": "write", "endpoints": [["ANY", "/admin/shop/product/{object_id}/change/", "django.contrib.admin.options.ModelAdmin.change_view"]], "check": "shop.change_product", "at": "shop/models.py:4", "basis": "extracted"},
    {"id": "shop.product.delete", "area": "shop.product", "term": "Product", "verb": "write", "endpoints": [["ANY", "/admin/shop/product/{object_id}/delete/", "django.contrib.admin.options.ModelAdmin.delete_view"]], "check": "shop.delete_product", "at": "shop/models.py:4", "basis": "extracted"},
    {"id": "shop.product.view", "area": "shop.product", "term": "Product", "verb": "read", "endpoints": [["ANY", "/admin/shop/product/", "django.contrib.admin.options.ModelAdmin.changelist_view"], ["ANY", "/admin/shop/product/{object_id}/history/", "django.contrib.admin.options.ModelAdmin.history_view"]], "check": "shop.view_product", "at": "shop/models.py:4", "basis": "extracted"}
  ],
  "endpoints": [
    {"method": "ANY", "path": "/admin/", "handler": "django.contrib.admin.sites.AdminSite.index", "layers": [], "permissions": [], "verdict": null, "fallback": {"kind": "staff", "basis": "extracted", "how": "Inventory: is_staff"}, "notes": []},
    {"method": "ANY", "path": "/admin/autocomplete/", "handler": "django.contrib.admin.sites.AdminSite.autocomplete_view", "layers": [], "permissions": [], "verdict": null, "fallback": {"kind": "staff", "basis": "extracted", "how": "Inventory: is_staff"}, "notes": []},
    {"method": "ANY", "path": "/admin/jsi18n/", "handler": "django.contrib.admin.sites.AdminSite.i18n_javascript", "layers": [], "permissions": [], "verdict": null, "fallback": {"kind": "staff", "basis": "extracted", "how": "Inventory: is_staff"}, "notes": []},
    {"method": "ANY", "path": "/admin/logout/", "handler": "django.contrib.admin.sites.AdminSite.logout", "layers": [], "permissions": [], "verdict": null, "fallback": {"kind": "staff", "basis": "extracted", "how": "Inventory: is_staff"}, "notes": []},
    {"method": "ANY", "path": "/admin/password_change/", "handler": "django.contrib.admin.sites.AdminSite.password_change", "layers": [], "permissions": [], "verdict": null, "fallback": {"kind": "staff", "basis": "extracted", "how": "Inventory: is_staff"}, "notes": []},
    {"method": "ANY", "path": "/admin/password_change/done/", "handler": "django.contrib.admin.sites.AdminSite.password_change_done", "layers": [], "permissions": [], "verdict": null, "fallback": {"kind": "staff", "basis": "extracted", "how": "Inventory: is_staff"}, "notes": []},
    {"method": "ANY", "path": "/admin/r/{content_type_id}/{object_id}/", "handler": "django.contrib.contenttypes.views.shortcut", "layers": [], "permissions": [], "verdict": null, "fallback": {"kind": "staff", "basis": "extracted", "how": "Inventory: is_staff"}, "notes": []},
    {"method": "ANY", "path": "/admin/shop/order/", "handler": "django.contrib.admin.options.ModelAdmin.changelist_view", "resource": "Back office · shop.order", "layers": [{"kind": "permission", "title": "Django has_view_permission", "text": "user.has_perm(shop.view_order)", "source": "admin introspection", "at": "shop/admin.py:12"}, {"kind": "permission", "title": "Django has_change_permission", "text": "Or, instead of the step above: user.has_perm(shop.change_order)", "source": "admin introspection", "at": "shop/admin.py:12"}, {"kind": "scope", "title": "OrderAdmin.get_queryset", "text": "Narrows which records exist for this user", "source": "admin introspection", "at": "shop/admin.py:13", "permissions": []}], "permissions": ["shop.change_order", "shop.view_order"], "verdict": null, "fallback": {"kind": "staff", "basis": "extracted", "how": "Inventory: is_staff"}, "notes": []},
    {"method": "ANY", "path": "/admin/shop/order/add/", "handler": "django.contrib.admin.options.ModelAdmin.add_view", "resource": "Back office · shop.order", "layers": [{"kind": "permission", "title": "Django has_add_permission", "text": "user.has_perm(shop.add_order)", "source": "admin introspection", "at": "shop/admin.py:12"}], "permissions": ["shop.add_order"], "verdict": null, "fallback": {"kind": "staff", "basis": "extracted", "how": "Inventory: is_staff"}, "notes": []},
    {"method": "ANY", "path": "/admin/shop/order/export/", "handler": "shop/admin.py:23", "resource": "Back office · shop.order", "layers": [{"kind": "view", "title": "Custom admin view", "text": "Exports the orders as CSV; checks has_change_permission.", "source": "curated", "at": "shop/admin.py:24"}, {"kind": "permission", "title": "Django has_change_permission", "text": "user.has_perm(shop.change_order)", "source": "admin introspection", "at": "shop/admin.py:12"}, {"kind": "scope", "title": "OrderAdmin.get_queryset", "text": "Narrows which records exist for this user", "source": "admin introspection", "at": "shop/admin.py:13", "permissions": []}], "permissions": ["shop.change_order"], "verdict": null, "fallback": {"kind": "staff", "basis": "rule", "how": "Recognition rule order_export_admin_view (shop/admin.py:20)"}, "notes": [["curated", "shop/admin.py:24 maps this URL to has_change_permission"]]},
    {"method": "ANY", "path": "/admin/shop/order/{object_id}/", "handler": "django.views.generic.base.RedirectView", "resource": "Back office · shop.order", "layers": [{"kind": "view", "title": "Redirect", "text": "Redirects to the edit form; the edit form decides.", "source": "django"}], "permissions": [], "verdict": {"kind": "staff", "basis": "inferred", "how": "The redirect only needs is_staff. The edit form behind it decides."}, "fallback": {"kind": "staff", "basis": "extracted", "how": "Inventory: is_staff"}, "notes": []},